{
  "atlasVersion": "0.1.0",
  "generated": "2026-06-12T00:00:00Z",
  "unit": "knowledge/EMBODIMENT_APPROACH.md §4.1 (pre-registered, commit 440bb78, locked before histogram)",
  "environment": {
    "elementorVersion": "unprobed (4.0.x per V4_ATOMIC_NORMALIZATIONS)",
    "elementorPro": true,
    "theme": "Hello Elementor",
    "plugins": ["joist (unverified at seed time)"],
    "kitHash": "unprobed"
  },
  "constructs": [
    {
      "id": "body-text",
      "aliases": [],
      "keyTriple": { "structuralSignature": "leaf", "contentClasses": "leaf:body-text", "propertyClasses": "*" },
      "histogram": { "count": 921, "sites": 7 },
      "authoringContract": {
        "snippet": "<p style=\"font-size:16px;color:#333;line-height:1.6\">Copy</p>",
        "constraints": ["computed values only (no CSS vars/clamp)", "inline style attrs for emphasis/max-width (kses-safe)"]
      },
      "elementorTarget": { "shape": "text-editor", "widgetTypes": ["text-editor"], "keySettings": { "editor": "HTML string (inline style attrs survive kses)", "text_color": "color" } },
      "expressibility": { "status": "assumed", "strategy": "native", "ceiling": "~100%", "notes": "Matrix Tier-1 paragraph row." },
      "probe": { "author": "PUT text-editor with inline-styled <p>; lenient-hash round-trip", "render": "screenshot widget box @1440", "assert": ["text present", "computed font-size/color match authored", "inline styles survived kses"] },
      "residualChannelDefault": "inline-style",
      "knownGaps": [],
      "provenance": ["knowledge/ELEMENTOR_CAPABILITY_MATRIX.md Tier-1 paragraph", "eval/grader/transpile-html.mjs text-editor mapping", "assumed-pending-probe"]
    },
    {
      "id": "heading",
      "aliases": [],
      "keyTriple": { "structuralSignature": "leaf", "contentClasses": "leaf:heading", "propertyClasses": "*" },
      "histogram": { "count": 115, "sites": 7 },
      "authoringContract": {
        "snippet": "<h2 style=\"font-size:48px;font-weight:600;color:#111\">Headline</h2>",
        "constraints": ["h1–h6 only", "solid paint here; gradient paint routes to inline-styled-text"]
      },
      "elementorTarget": { "shape": "heading", "widgetTypes": ["heading"], "keySettings": { "title": "text", "header_size": "h1–h6", "align": "NOT text_align", "title_color": "color", "typography_*": "full set" } },
      "expressibility": { "status": "assumed", "strategy": "native", "ceiling": "~100%", "notes": "Matrix Tier-1 heading row; `align` spelling verified in matrix." },
      "probe": { "author": "PUT heading h1..h6 with typography_* set", "render": "screenshot + computed-style diff", "assert": ["tag level correct", "font-size/weight/color match", "align honored"] },
      "residualChannelDefault": "custom_css",
      "knownGaps": ["gradient-text headline needs custom_css background-clip:text (matrix)"],
      "provenance": ["knowledge/ELEMENTOR_CAPABILITY_MATRIX.md Tier-1 heading", "eval/grader/transpile-html.mjs heading mapping", "assumed-pending-probe"]
    },
    {
      "id": "button-cta",
      "aliases": [],
      "keyTriple": { "structuralSignature": "leaf", "contentClasses": "leaf:button-cta", "propertyClasses": "*" },
      "histogram": { "count": 231, "sites": 7 },
      "authoringContract": {
        "snippet": "<a class=\"btn\" href=\"/x\" style=\"background:#16a34a;color:#fff;border-radius:8px;padding:12px 20px\">Get started →</a>",
        "constraints": ["trailing/leading glyph spans lift to native button icon (transpiler P1)", "styled inline spans inside button text are flattened (Elementor button text is plain)"]
      },
      "elementorTarget": { "shape": "button", "widgetTypes": ["button"], "keySettings": { "text": "label", "link": "{url}", "button_text_color": "NOT text_color", "background_color": "bg", "selected_icon": "{value:'fas fa-*',library:'fa-solid'}", "icon_align": "left|right", "hover_color/button_background_hover_color": "native hover" } },
      "expressibility": { "status": "assumed", "strategy": "native", "ceiling": "~100%", "notes": "Matrix Tier-1 button row + transpiler P1 icon-lift." },
      "probe": { "author": "PUT button with icon + hover colors", "render": "screenshot static + :hover state", "assert": ["label/icon present", "bg/text colors match", "hover swap fires"] },
      "residualChannelDefault": "custom_css",
      "knownGaps": ["per-span color/weight inside button text lost (plain text only)", "custom easing / different in-out hover durations need custom_css"],
      "provenance": ["knowledge/ELEMENTOR_CAPABILITY_MATRIX.md Tier-1 button", "eval/grader/transpile-html.mjs buttonWidget/P1", "assumed-pending-probe"]
    },
    {
      "id": "image",
      "aliases": [],
      "keyTriple": { "structuralSignature": "leaf", "contentClasses": "leaf:image", "propertyClasses": "*" },
      "histogram": { "count": 99, "sites": 7 },
      "authoringContract": {
        "snippet": "<img src=\"https://…/x.jpg\" alt=\"…\" style=\"width:560px;border-radius:12px\">",
        "constraints": ["upload to media library (sized variants + alt) — never fake CDN URLs", "HTTPS URLs", "radius authored on the wrapping container"]
      },
      "elementorTarget": { "shape": "container > image", "widgetTypes": ["image"], "keySettings": { "image": "{url,id}", "border_radius": "on the WRAPPING CONTAINER, not the widget (matrix)" } },
      "expressibility": { "status": "assumed", "strategy": "native", "ceiling": "~100%", "notes": "Matrix Tier-1 image row." },
      "probe": { "author": "PUT image via media library + container radius", "render": "screenshot; natural-size vs rendered box", "assert": ["image paints (no lazy-void)", "radius applied", "alt present"] },
      "residualChannelDefault": "region-raster",
      "knownGaps": [],
      "provenance": ["knowledge/ELEMENTOR_CAPABILITY_MATRIX.md Tier-1 image", "memory vision_tiler_lazyload_falsevoid (lazy settle before judging)", "assumed-pending-probe"]
    },
    {
      "id": "icon-svg",
      "aliases": [],
      "keyTriple": { "structuralSignature": "leaf", "contentClasses": "leaf:icon-svg", "propertyClasses": "*" },
      "histogram": { "count": 72, "sites": 6 },
      "authoringContract": {
        "snippet": "<svg width=\"20\" height=\"20\" …>…</svg> (inline, or known FA glyph name)",
        "constraints": ["library icon → Icon List item or FA name", "custom brand svg → inline <svg> in html widget"]
      },
      "elementorTarget": { "shape": "icon-list item OR html(inline svg)", "widgetTypes": ["icon-list", "html"], "keySettings": { "note": "standalone `icon` widget controls flaky on this stack (matrix VERIFY #4)" } },
      "expressibility": { "status": "assumed", "strategy": "widget-composition", "ceiling": "~90% lib / ~100% inline-svg html", "notes": "Matrix Tier-1 icon row." },
      "probe": { "author": "PUT icon-list w/ FA icon AND html w/ inline svg", "render": "screenshot both", "assert": ["glyph visible at authored size/color", "inline svg survives kses"] },
      "residualChannelDefault": "html-widget",
      "knownGaps": ["standalone icon widget acceptance unverified on this install"],
      "provenance": ["knowledge/ELEMENTOR_CAPABILITY_MATRIX.md Tier-1 icon", "assumed-pending-probe"]
    },
    {
      "id": "logo",
      "aliases": [],
      "keyTriple": { "structuralSignature": "leaf", "contentClasses": "leaf:logo", "propertyClasses": "*" },
      "histogram": { "count": 29, "sites": 4 },
      "authoringContract": { "snippet": "<img src=\"…/logo.svg\" alt=\"Brand\" style=\"height:28px\">", "constraints": ["exact source asset (wrong-logo is a top human-salient defect — memory grader_overstates_top_end)"] },
      "elementorTarget": { "shape": "image (svg upload) OR html(inline svg)", "widgetTypes": ["image", "html"], "keySettings": {} },
      "expressibility": { "status": "assumed", "strategy": "native", "ceiling": "~100%", "notes": "Same mechanics as image; saliency threshold STRICT (move d)." },
      "probe": { "author": "PUT brand svg via media library", "render": "crop logo region, compare to source crop", "assert": ["correct asset (not placeholder)", "aspect preserved"] },
      "residualChannelDefault": "html-widget",
      "knownGaps": [],
      "provenance": ["memory grader_overstates_top_end (logo saliency)", "assumed-pending-probe"]
    },
    {
      "id": "stat-number",
      "aliases": [],
      "keyTriple": { "structuralSignature": "leaf", "contentClasses": "leaf:stat-number", "propertyClasses": "*" },
      "histogram": { "count": 49, "sites": 4 },
      "authoringContract": { "snippet": "<div class=\"stat\"><span style=\"font-size:56px;font-weight:700\">99.9%</span><p>uptime</p></div>", "constraints": ["static number = heading widget; count-up animation only via Pro Counter"] },
      "elementorTarget": { "shape": "heading (static) | counter [Pro] (animated)", "widgetTypes": ["heading", "counter"], "keySettings": {} },
      "expressibility": { "status": "assumed", "strategy": "native", "ceiling": "~95% Pro / ~90% static free", "proRequired": false, "notes": "Matrix Tier-2 stat row." },
      "probe": { "author": "PUT heading-number + Pro counter variant", "render": "screenshot; scroll-into-view for counter", "assert": ["value renders", "counter animates on view (Pro)"] },
      "residualChannelDefault": "none",
      "knownGaps": ["free count-up animation (script stripped) — Pro Counter or packaged handler only"],
      "provenance": ["knowledge/ELEMENTOR_CAPABILITY_MATRIX.md Tier-2 stat/counter", "assumed-pending-probe"]
    },
    {
      "id": "badge-pill",
      "aliases": [],
      "keyTriple": { "structuralSignature": "leaf", "contentClasses": "leaf:badge-pill", "propertyClasses": "rad:pill-circle" },
      "histogram": { "count": 13, "sites": 3 },